{
  "contract": "semgrep-research-profile-v1",
  "profile_id": "gitlab-python-68-development-v1",
  "status": "development-candidate",
  "tool_id": "semgrep",
  "tool_version": "1.174.0",
  "image": "semgrep/semgrep@sha256:f1f7b71861c7b28b6e0f661225a2c4f58a484f5d0f182465c6d6b3b22f972ade",
  "source_repository": "https://gitlab.com/gitlab-org/security-products/sast-rules",
  "source_revision": "53bf5cf6df3c51b6c02110f5a638b5e6213666cd",
  "source_license_sha256": "33acf42afdd03163d75fe856cb431e70710e0b5deede3362e6d1c4697cfe1c6a",
  "rules": [
    {
      "source_path": "python/assert/rule-assert-used.yml",
      "sha256": "75bf2c385362bd942562948c46e4ca06962fe0267c42234e577a6a5b7a5214f6",
      "native_rule_id": "python_assert_rule-assert-used",
      "license_expression": "MIT",
      "upstream_test_state": "passed"
    },
    {
      "source_path": "python/bind_all_interfaces/rule-general-bindall-interfaces.yml",
      "sha256": "f0e93ecf57e8deb595c013ff1a9133223ff5aa3552e18c610cf93302b7dd0b86",
      "native_rule_id": "python_bind-all-interfaces_rule-general-bindall-interfaces",
      "license_expression": "MIT",
      "upstream_test_state": "passed"
    },
    {
      "source_path": "python/crypto/rule-cipher-modes.yml",
      "sha256": "579be41611e34d423691c9341ea6e9b5471d35ac934b09d119646ad2bb04b779",
      "native_rule_id": "python_crypto_rule-cipher-modes",
      "license_expression": "MIT",
      "upstream_test_state": "passed"
    },
    {
      "source_path": "python/crypto/rule-crypto-cipher-blowfish.yml",
      "sha256": "98432fc326baaeedf04ce105093d30593777e9c50db378bbfb56de606096f349",
      "native_rule_id": "python_crypto_rule-crypto-cipher-blowfish",
      "license_expression": "MIT",
      "upstream_test_state": "passed"
    },
    {
      "source_path": "python/crypto/rule-crypto-cipher-des.yml",
      "sha256": "c4a72951ba44060b5957566aed08086242a7755d256fa791df87b8ffc861b138",
      "native_rule_id": "python_crypto_rule-crypto-cipher-des",
      "license_expression": "MIT",
      "upstream_test_state": "passed"
    },
    {
      "source_path": "python/crypto/rule-crypto-cipher-rc2.yml",
      "sha256": "4c6b7354a6b6990c37406ff457054b4a1513c654ad0c9a97a7ccca765238ee46",
      "native_rule_id": "python_crypto_rule-crypto-cipher-rc2",
      "license_expression": "MIT",
      "upstream_test_state": "passed"
    },
    {
      "source_path": "python/crypto/rule-crypto-cipher-rc4.yml",
      "sha256": "1a152e8a7f9fa44f6639df7e199023906983402f434732ae1b9200377aee92dc",
      "native_rule_id": "python_crypto_rule-crypto-cipher-rc4",
      "license_expression": "MIT",
      "upstream_test_state": "passed"
    },
    {
      "source_path": "python/crypto/rule-crypto-cipher-xor.yml",
      "sha256": "a94a1eb095d2c8b4ac1ed9e0c7e118c0fb5a4412edd02fa72e6a57ad6ea0cda6",
      "native_rule_id": "python_crypto_rule-crypto-cipher-xor",
      "license_expression": "MIT",
      "upstream_test_state": "passed"
    },
    {
      "source_path": "python/crypto/rule-crypto-encrypt-dsa-rsa.yml",
      "sha256": "9fadf035dac3736e3de1d6d1463cda3659fb7a4281c3cfc19ac3146034f0f517",
      "native_rule_id": "python_crypto_rule-crypto-encrypt-dsa-rsa",
      "license_expression": "MIT",
      "upstream_test_state": "passed"
    },
    {
      "source_path": "python/crypto/rule-crypto-encrypt-ec.yml",
      "sha256": "c2e7a1c70a6730c575af68b8c0d0a2de803a5f291303f7147f9aa4f62a9c2f6f",
      "native_rule_id": "python_crypto_rule-crypto-encrypt-ec",
      "license_expression": "MIT",
      "upstream_test_state": "passed"
    },
    {
      "source_path": "python/crypto/rule-crypto-hash-md5.yml",
      "sha256": "d2df42348852a44fcc61bb02a39de831c0940bad9e0069809404cc412f3d7e8a",
      "native_rule_id": "python_crypto_rule-crypto-hash-md5",
      "license_expression": "MIT",
      "upstream_test_state": "passed"
    },
    {
      "source_path": "python/crypto/rule-crypto-hash-sha1.yml",
      "sha256": "576a2466dab13cb4cf3d7ab1a034b83c31b12ddf4f077baf25a856ddeb07555b",
      "native_rule_id": "python_crypto_rule-crypto-hash-sha1",
      "license_expression": "MIT",
      "upstream_test_state": "passed"
    },
    {
      "source_path": "python/crypto/rule-crypto-hazmat-cipher-arc4.yml",
      "sha256": "86a2fcd4d721ba5050168e6d00b653b8ff8eb14c9847b91dc58db9dec5b120a4",
      "native_rule_id": "python_crypto_rule-crypto-hazmat-cipher-arc4",
      "license_expression": "MIT",
      "upstream_test_state": "passed"
    },
    {
      "source_path": "python/crypto/rule-crypto-hazmat-cipher-blowfish.yml",
      "sha256": "6664d107499416988b11b624e85fa3158191d0cec5bae71754df6405d62d90e1",
      "native_rule_id": "python_crypto_rule-crypto-hazmat-cipher-blowfish",
      "license_expression": "MIT",
      "upstream_test_state": "passed"
    },
    {
      "source_path": "python/crypto/rule-crypto-hazmat-cipher-idea.yml",
      "sha256": "37e222953c38028e03a1d0c8f595dc87cf694a95a38c8b802aa7acf2af1da657",
      "native_rule_id": "python_crypto_rule-crypto-hazmat-cipher-idea",
      "license_expression": "MIT",
      "upstream_test_state": "passed"
    },
    {
      "source_path": "python/crypto/rule-crypto-hazmat-hash-md5.yml",
      "sha256": "d65341d672ab0679e48d063fd026418ea45fb6644b8a3f2f004be18d2d61e9c6",
      "native_rule_id": "python_crypto_rule-crypto.hazmat-hash-md5",
      "license_expression": "MIT",
      "upstream_test_state": "passed"
    },
    {
      "source_path": "python/crypto/rule-crypto-hazmat-hash-sha1.yml",
      "sha256": "2e49a98758c396b7936efc6f6faed848a00f93220319878ed2af5a320d294c34",
      "native_rule_id": "python_crypto_rule-crypto.hazmat-hash-sha1",
      "license_expression": "MIT",
      "upstream_test_state": "passed"
    },
    {
      "source_path": "python/crypto/rule-hash-md2.yml",
      "sha256": "ce8e79cb18041ef60d38012ba0002525d4db8036e90acd944584f0ef9436f24f",
      "native_rule_id": "python_crypto_rule-hash-md2",
      "license_expression": "MIT",
      "upstream_test_state": "passed"
    },
    {
      "source_path": "python/crypto/rule-hash-md4.yml",
      "sha256": "a1c01385a5604c3ec52ffb52a1782cc3d1803f42d8bb92e2ac8b1b9375774822",
      "native_rule_id": "python_crypto_rule-hash-md4",
      "license_expression": "MIT",
      "upstream_test_state": "passed"
    },
    {
      "source_path": "python/crypto/rule-hash-md5.yml",
      "sha256": "a1ea675f50c0404e7dcc1c94630a18cfae6251afdcdc17a23922309beb15d09c",
      "native_rule_id": "python_crypto_rule-hash-md5",
      "license_expression": "MIT",
      "upstream_test_state": "passed"
    },
    {
      "source_path": "python/crypto/rule-hash-sha1.yml",
      "sha256": "31cbaf048f10d1937c434ff461c962b24336213c1455c3f20cdb0498b3a968da",
      "native_rule_id": "python_crypto_rule-hash-sha1",
      "license_expression": "MIT",
      "upstream_test_state": "passed"
    },
    {
      "source_path": "python/crypto/rule-hashlib-new-insecure-functions.yml",
      "sha256": "894ff7b3a25230c15572c24ab7872afcf357ac29965482cf1a36d7ac21ecc43c",
      "native_rule_id": "python_crypto_rule-hashlib-new-insecure-functions",
      "license_expression": "MIT",
      "upstream_test_state": "passed"
    },
    {
      "source_path": "python/crypto/rule-import-pycrypto.yml",
      "sha256": "b78ad33eb3f0c485638d92e028cf42cf12466e7978fd1f49eda3c5dc2786c919",
      "native_rule_id": "python_crypto_rule-import-pycrypto",
      "license_expression": "MIT",
      "upstream_test_state": "passed"
    },
    {
      "source_path": "python/deserialization/rule-cpickle.yml",
      "sha256": "6f481a1ad60a0b17d23747518da2e884e4642e9c505f17b50eeb4c6db9aadaf8",
      "native_rule_id": "python_deserialization_rule-cpickle",
      "license_expression": "MIT",
      "upstream_test_state": "passed"
    },
    {
      "source_path": "python/deserialization/rule-dill.yml",
      "sha256": "33c5f3b59b33ba8eb1b8f68b6e404d821d5c1c9eda5f3c919784ab4e2ec87fef",
      "native_rule_id": "python_deserialization_rule-dill",
      "license_expression": "MIT",
      "upstream_test_state": "passed"
    },
    {
      "source_path": "python/deserialization/rule-marshal.yml",
      "sha256": "0a028a60ea0453bafe18c0eb865b9a72a200a5b13aa7d2dd49efb13870ca0dfb",
      "native_rule_id": "python_deserialization_rule-marshal",
      "license_expression": "MIT",
      "upstream_test_state": "passed"
    },
    {
      "source_path": "python/deserialization/rule-pickle.yml",
      "sha256": "604febbd00d5d0aec6f12b515330aa99cb39af30e237afa64415fcc70c8a2a8d",
      "native_rule_id": "python_deserialization_rule-pickle",
      "license_expression": "MIT",
      "upstream_test_state": "passed"
    },
    {
      "source_path": "python/deserialization/rule-shelve.yml",
      "sha256": "c7e2ac0f2571009e65d9596adeffed22ab962270774a046a0cdd5afd9857d1bb",
      "native_rule_id": "python_deserialization_rule-shelve",
      "license_expression": "MIT",
      "upstream_test_state": "passed"
    },
    {
      "source_path": "python/deserialization/rule-yaml-load.yml",
      "sha256": "f356f893e9b58b637209f0079bc3f60ff4d84b4b3c46858333682d2682e50572",
      "native_rule_id": "python_deserialization_rule-yaml-load",
      "license_expression": "MIT",
      "upstream_test_state": "passed"
    },
    {
      "source_path": "python/django/rule-django-extra-used.yml",
      "sha256": "37dcc477c25cc1cd092581ec2efc629ca221f4a11675f161e563d276bc3c8576",
      "native_rule_id": "python_django_rule-django-extra-used",
      "license_expression": "MIT",
      "upstream_test_state": "passed"
    },
    {
      "source_path": "python/escaping/rule-jinja2-autoescape-false.yml",
      "sha256": "4a6273aa13150b0e0a7810e601ccac7fbf24e4b26add58a638424f0789112826",
      "native_rule_id": "python_escaping_rule-jinja2-autoescape-false",
      "license_expression": "MIT",
      "upstream_test_state": "passed"
    },
    {
      "source_path": "python/escaping/rule-use-of-mako-templates.yml",